{
  "$schema": "actors-v1.schema.json",
  "schemaVersion": "job-atlas-actor-catalogue-v1",
  "scope": {
    "observedAt": "2026-09-21T18:10:47.921478+00:00",
    "sourceRevision": "6742f11452d79ae20b7c01d478acb2cb25ee725a",
    "sourceRepository": "https://github.com/Exdenta/jobatlas",
    "inventoryCounts": {
      "ownedActors": 92,
      "ownedInScopePublic": 58,
      "ownedPrivateSupportExcluded": 16,
      "ownedUnrelatedPublicExcluded": 18,
      "promotedJobAtlasDeployments": 17,
      "inScopeDeployments": 75
    },
    "inclusionRule": "Include every public nomad-agent Actor whose current title or slug identifies a job-search, job-enrichment, job-bundle, or candidate-fit product, plus every public jobatlas deployment maintained by this repository.",
    "evidenceBoundary": "The owned-account totals retain their dated historical snapshot. Public endpoints and latest build metadata were rechecked on 4 October 2026. Build metadata does not prove a successful execution, complete descriptions, optional processing or destination delivery. The complete public directory also covers the non-job products excluded from this job integration catalogue. Input examples are documentation and do not guarantee matching results."
  },
  "contractProfiles": [
    {
      "id": "normalized-job-v1",
      "name": "Normalized source job",
      "canonicalRoots": [
        "schemaVersion",
        "identity",
        "data",
        "custom",
        "llm",
        "raw"
      ],
      "schemaPaths": [
        "integrations/shared/nomad-agent-job-v1.schema.json",
        "integrations/shared/flat-job-v1.schema.json",
        "integrations/shared/run-summary-v4.schema.json",
        "integrations/shared/run-summary-v3.schema.json"
      ],
      "currentRunSummary": "nomad-agent-run-summary-v4",
      "legacyRunSummaries": [
        "nomad-agent-run-summary-v3"
      ],
      "postingKey": {
        "primary": "{source}:{externalId}",
        "fallback": "{source}:{url}"
      },
      "destinationKey": "jobKey",
      "emptyValueSemantics": "Unknown scalar values stay null, known-empty collections stay [], and raw: null is valid when raw capture is disabled."
    },
    {
      "id": "job-fit-v1",
      "name": "Candidate-specific job fit",
      "canonicalRoots": [
        "schemaVersion",
        "identity",
        "job",
        "candidate",
        "fit",
        "delivery"
      ],
      "schemaPaths": [
        "integrations/shared/nomad-ai-job-fit-v1.schema.json",
        "integrations/shared/nomad-ai-job-fit-destination-v1.schema.json",
        "integrations/shared/nomad-ai-job-fit-run-summary-v4.schema.json",
        "integrations/shared/nomad-ai-job-fit-run-summary-v3.schema.json"
      ],
      "currentRunSummary": "nomad-ai-job-fit-run-summary-v4",
      "legacyRunSummaries": [
        "nomad-ai-job-fit-run-summary-v3"
      ],
      "postingKey": "jobKey",
      "destinationKey": "matchKey",
      "emptyValueSemantics": "A fit row keeps the source posting jobKey and uses candidate-specific matchKey for destination upserts; it is never passed through the flat-job mapper."
    },
    {
      "id": "simple-inventory-job-v2",
      "name": "Historical simple job row v2",
      "canonicalRoots": [
        "schemaVersion",
        "recordType",
        "source",
        "id",
        "url",
        "title",
        "company",
        "locations",
        "postedAt",
        "deadline",
        "description",
        "descriptionHtml",
        "workType",
        "salary"
      ],
      "schemaPaths": [
        "integrations/shared/nomad-agent-job-row-v2.schema.json",
        "integrations/shared/inventory-run-summary-v1.schema.json"
      ],
      "currentRunSummary": "nomad-inventory-public-run-v1",
      "legacyRunSummaries": [],
      "postingKey": {
        "primary": "{source}:{id}",
        "fallback": "{source}:{url}"
      },
      "destinationKey": "jobKey",
      "emptyValueSemantics": "Optional scalar facts are null. Locations are [] when no usable source location was parsed. Full description and HTML are mandatory."
    },
    {
      "id": "normalized-inventory-job-v1",
      "name": "normalized job v1",
      "canonicalRoots": [
        "schemaVersion",
        "identity",
        "data",
        "custom",
        "llm",
        "raw"
      ],
      "schemaPaths": [
        "integrations/shared/nomad-agent-job-v1.schema.json",
        "integrations/shared/inventory-run-summary-v1.schema.json"
      ],
      "currentRunSummary": "nomad-inventory-public-run-v1",
      "legacyRunSummaries": [],
      "postingKey": {
        "primary": "{source}:{externalId}",
        "fallback": "{source}:{url}"
      },
      "destinationKey": "jobKey",
      "emptyValueSemantics": "Unknown facts stay null and known-empty collections stay []. Complete raw text is always retained; source HTML may be unavailable."
    },
    {
      "id": "simple-job-row-v3",
      "name": "Simple source job row v3",
      "canonicalRoots": [
        "schemaVersion",
        "source",
        "id",
        "url",
        "title",
        "company",
        "locations",
        "postedAt",
        "deadline",
        "description",
        "descriptionHtml",
        "workType",
        "salary",
        "employmentTypes",
        "hiringContacts"
      ],
      "schemaPaths": [
        "integrations/shared/nomad-agent-job-row-v3.schema.json",
        "integrations/shared/inventory-run-summary-v1.schema.json"
      ],
      "currentRunSummary": "nomad-inventory-public-run-v1",
      "legacyRunSummaries": [],
      "postingKey": {
        "primary": "{source}:{id}",
        "fallback": "{source}:{url}"
      },
      "destinationKey": "jobKey",
      "emptyValueSemantics": "Unknown scalar facts and employmentTypes stay null; locations are [] when no usable location is parsed, and hiringContacts are [] when no named people are supplied. Full description and HTML are mandatory. No recordType field."
    }
  ],
  "logicalProducts": [
    {
      "id": "wellfound-scraper",
      "name": "Wellfound startup jobs",
      "kind": "source-scraper",
      "lifecycle": "legacy-live",
      "promotion": "not-planned",
      "implementationSource": {
        "state": "not-in-repository",
        "location": null,
        "evidence": "Hosted Actor; this repository documents its public contracts and client integrations."
      },
      "contractProfileId": "simple-job-row-v3",
      "maintainedExamples": [
        "docs/simple-inventory-sources.md"
      ]
    },
    {
      "id": "devex-scraper",
      "name": "Devex international-development jobs",
      "kind": "source-scraper",
      "lifecycle": "legacy-live",
      "promotion": "not-planned",
      "implementationSource": {
        "state": "not-in-repository",
        "location": null,
        "evidence": "Hosted Actor; this repository documents its public contracts and client integrations."
      },
      "contractProfileId": null,
      "maintainedExamples": [
        "docs/job-actor-input-examples.md"
      ]
    },
    {
      "id": "linkedin-enrich-translate-normalize-scraper",
      "name": "LinkedIn Jobs Scraper | AI Enrichment",
      "kind": "source-scraper",
      "lifecycle": "promoted",
      "promotion": "job-atlas",
      "implementationSource": {
        "state": "not-in-repository",
        "location": null,
        "evidence": "Hosted Actor; this repository documents its public contracts and client integrations."
      },
      "contractProfileId": "normalized-job-v1",
      "maintainedExamples": [
        "docs/linkedin.md",
        "integrations/api/linkedin-search.json",
        "integrations/mcp/examples/linkedin-search.mcp.json",
        "integrations/n8n/linkedin-daily-job-alerts.json",
        "integrations/n8n/linkedin-jobs-to-google-sheets.json",
        "integrations/make/linkedin-jobs-to-google-sheets.blueprint.json",
        ".agents/skills/linkedin-enrich-translate-normalize-scraper/SKILL.md"
      ]
    },
    {
      "id": "ai-job-fit-scorer",
      "name": "AI Job Search & Fit Scorer",
      "kind": "fit-scorer",
      "lifecycle": "promoted",
      "promotion": "job-atlas",
      "implementationSource": {
        "state": "not-in-repository",
        "location": null,
        "evidence": "Hosted Actor; this repository documents its public contracts and client integrations."
      },
      "contractProfileId": "job-fit-v1",
      "maintainedExamples": [
        "docs/ai-job-fit-scorer.md",
        "integrations/api/ai-job-fit-scorer-input.json",
        "integrations/api/ai-job-fit-scorer-run-and-fetch.mjs",
        "integrations/mcp/examples/ai-job-fit-scorer.mcp.json",
        "integrations/n8n/ai-job-fit-scorer-to-google-sheets.json",
        "integrations/make/ai-job-fit-scorer-to-google-sheets.blueprint.json",
        "integrations/zapier/ai-job-fit-scorer-template-spec.json",
        ".agents/skills/ai-job-fit-scorer/SKILL.md"
      ]
    },
    {
      "id": "ycombinator-enrich-translate-normalize-scraper",
      "name": "Y Combinator normalized jobs",
      "kind": "source-scraper",
      "lifecycle": "promoted",
      "promotion": "job-atlas",
      "implementationSource": {
        "state": "not-in-repository",
        "location": null,
        "evidence": "Hosted Actor; this repository documents its public contracts and client integrations."
      },
      "contractProfileId": "normalized-job-v1",
      "maintainedExamples": [
        "docs/ycombinator.md",
        ".agents/skills/ycombinator-enrich-translate-normalize-scraper/SKILL.md"
      ]
    },
    {
      "id": "euraxess-enrich-translate-normalize-scraper",
      "name": "EURAXESS Jobs Scraper | Full Details & AI Enrichment",
      "kind": "source-scraper",
      "lifecycle": "promoted",
      "promotion": "job-atlas",
      "implementationSource": {
        "state": "not-in-repository",
        "location": null,